county,county_name,district,district_name,k12_enrollment,reduced,free,total_reduced_free,percent_reduced_free,year
42,Hardin,9,AGWSR Comm School District,599,,,231,38.56,2022
39,Guthrie,18,Adair-Casey Comm School District,253,,,114,45.06,2022
25,Dallas,27,Adel DeSoto Minburn Comm School District,2204,,,414,18.78,2022
75,Plymouth,63,Akron Westfield Comm School District,580,,,193,33.28,2022
11,Buena Vista,72,Albert City-Truesdale Comm School District,102,,,54,52.94,2022
68,Monroe,81,Albia Comm School District,1064,,,437,41.07,2022
57,Linn,99,Alburnett Comm School District,766,,,165,21.54,2022
42,Hardin,108,Alden Comm School District,129,,,51,39.53,2022
55,Kossuth,126,Algona Comm School District,1423,,,515,36.19,2022
3,Allamakee,135,Allamakee Comm School District,1068,,,451,42.23,2022
12,Butler,153,North Butler Comm School District,517,,,147,28.43,2022
11,Buena Vista,171,Alta-Aurelia Comm School District,789,,,322,40.81,2022
85,Story,225,Ames Comm School District,4416,,,1423,32.22,2022
53,Jones,234,Anamosa Comm School District,1113,,,465,41.78,2022
49,Jackson,243,Andrew Comm School District,124,,,41,33.06,2022
77,Polk,261,Ankeny Comm School District,12399,,,2369,19.11,2022
12,Butler,279,Aplington-Parkersburg Comm School District,820,,,220,26.83,2022
32,Emmet,333,North Union Comm School District,305,,,161,52.79,2022
24,Crawford,355,Ar-We-Va Comm School District,224,,,91,40.63,2022
15,Cass,387,Atlantic Comm School District,1485,,,608,40.94,2022
5,Audubon,414,Audubon Comm School District,508,,,203,39.96,2022
78,Pottawattamie,441,AHSTW Comm School District,732,,,283,38.66,2022
85,Story,472,Ballard Comm School District,1823,,,304,16.68,2022
50,Jasper,513,Baxter Comm School District,458,,,135,29.48,2022
38,Grundy,540,BCLUW Comm School District,476,,,196,41.18,2022
87,Taylor,549,Bedford Comm School District,498,,,190,38.15,2022
6,Benton,576,Belle Plaine Comm School District,450,,,183,40.67,2022
49,Jackson,585,Bellevue Comm School District,705,,,175,24.82,2022
99,Wright,594,Belmond-Klemme Comm School District,653,,,343,52.53,2022
16,Cedar,603,Bennett Comm School District,69,,,33,47.83,2022
6,Benton,609,Benton Comm School District,1530,,,374,24.44,2022
82,Scott,621,Bettendorf Comm School District,4336,,,1471,33.93,2022
90,Wapello,657,Eddyville-Blakesburg- Fremont CSD,902,,,332,36.81,2022
77,Polk,720,Bondurant-Farrar Comm School District,2592,,,531,20.49,2022
8,Boone,729,Boone Comm School District,1890,,,737,38.99,2022
84,Sioux,747,Boyden-Hull Comm School District,566,,,227,40.11,2022
41,Hancock,819,West Hancock Comm School District,542,,,209,38.56,2022
79,Poweshiek,846,Brooklyn-Guernsey-Malcom Comm School District,532,,,184,34.59,2022
95,Winnebago,873,North Iowa Comm School District,446,,,197,44.17,2022
29,Des Moines,882,Burlington Comm School District,3154,,,2037,64.58,2022
15,Cass,914,CAM Comm School District,1415,,,598,42.26,2022
35,Franklin,916,CAL Comm School District,140,,,86,61.43,2022
23,Clinton,918,Calamus-Wheatland Comm School District,400,,,143,35.75,2022
23,Clinton,936,Camanche Comm School District,937,,,366,39.06,2022
90,Wapello,977,Cardinal Comm School District,947,,,490,51.74,2022
91,Warren,981,Carlisle Comm School District,2242,,,689,30.73,2022
14,Carroll,999,Carroll Comm School District,1626,,,607,37.33,2022
7,Black Hawk,1044,Cedar Falls Comm School District,5688,,,1549,27.23,2022
57,Linn,1053,Cedar Rapids Comm School District,14689,,,8105,55.18,2022
57,Linn,1062,Center Point-Urbana Comm School District,1393,,,235,16.87,2022
4,Appanoose,1071,Centerville Comm School District,1278,,,615,48.12,2022
56,Lee,1079,Central Lee Comm School District,1187,,,450,37.91,2022
22,Clayton,1080,Central Comm School District,431,,,178,41.3,2022
23,Clinton,1082,Central DeWitt School District,1509,,,477,31.61,2022
57,Linn,1089,Central City Comm School District,413,,,132,31.96,2022
27,Decatur,1093,Central Decatur Comm School District,646,,,437,67.65,2022
60,Lyon,1095,Central Lyon Comm School District,747,,,203,27.18,2022
59,Lucas,1107,Chariton Comm School District,1215,,,654,53.83,2022
34,Floyd,1116,Charles City Comm School District,1459,,,795,54.49,2022
24,Crawford,1134,Charter Oak-Ute Comm School District,166,,,99,59.64,2022
18,Cherokee,1152,Cherokee Comm School District,1144,,,467,40.82,2022
73,Page,1197,Clarinda Comm School District,1028,,,421,40.95,2022
99,Wright,1206,Clarion-Goldfield-Dows Comm School District,978,,,569,58.18,2022
20,Clarke,1211,Clarke Comm School District,1281,,,746,58.24,2022
12,Butler,1215,Clarksville Comm School District,282,,,97,34.4,2022
21,Clay,1218,Clay Central-Everly Comm School District,60,,,43,71.67,2022
52,Johnson,1221,Clear Creek Amana Comm School District,2874,,,751,26.13,2022
17,Cerro Gordo,1233,Clear Lake Comm School District,1402,,,438,31.24,2022
23,Clinton,1278,Clinton Comm School District,3212,,,1829,56.94,2022
50,Jasper,1332,Colfax-Mingo Comm School District,658,,,266,40.43,2022
57,Linn,1337,College Comm School District,5462,,,1941,35.54,2022
85,Story,1350,Collins-Maxwell Comm School District,394,,,157,39.85,2022
85,Story,1359,Colo-NESCO  Comm School District,349,,,137,39.26,2022
58,Louisa,1368,Columbus Comm School District,619,,,405,65.43,2022
14,Carroll,1413,Coon Rapids-Bayard Comm School District,402,,,194,48.26,2022
2,Adams,1431,Corning Comm School District,396,,,172,43.43,2022
78,Pottawattamie,1476,Council Bluffs Comm School District,8265,,,5089,61.57,2022
88,Union,1503,Creston Comm School District,1330,,,697,52.41,2022
25,Dallas,1576,Dallas Center-Grimes Comm School District,3521,,,621,17.64,2022
29,Des Moines,1602,Danville  Comm School District,626,,,227,36.26,2022
82,Scott,1611,Davenport Comm School District,13288,,,7248,54.55,2022
26,Davis,1619,Davis County Comm School District,1210,,,539,44.55,2022
96,Winneshiek,1638,Decorah Community School District,1558,,,394,25.29,2022
23,Clinton,1675,Delwood Comm School District,135,,,53,39.26,2022
24,Crawford,1701,Denison Comm School District,2143,,,1386,64.68,2022
9,Bremer,1719,Denver Comm School District,936,,,129,13.78,2022
77,Polk,1737,Des Moines Independent Comm School District,29029,,,22421,77.24,2022
80,Ringgold,1782,Diagonal Comm School District,114,,,50,43.86,2022
38,Grundy,1791,Dike-New Hartford Comm School District,904,,,164,18.14,2022
31,Dubuque,1863,Dubuque Comm School District,9722,,,4002,41.16,2022
7,Black Hawk,1908,Dunkerton Comm School District,382,,,166,43.46,2022
43,Harrison,1917,Boyer Valley Comm School District,375,,,151,40.27,2022
16,Cedar,1926,Durant Comm School District,642,,,201,31.31,2022
99,Wright,1944,Eagle Grove Comm School District,947,,,635,67.05,2022
61,Madison,1953,Earlham Comm School District,598,,,116,19.4,2022
10,Buchanan,1963,East Buchanan Comm School District,545,,,182,33.39,2022
49,Jackson,1965,Easton Valley Comm School District,453,,,168,37.09,2022
64,Marshall,1968,East Marshall Comm School District,690,,,260,37.68,2022
88,Union,1970,East Union Comm School District,462,,,266,57.58,2022
3,Allamakee,1972,Eastern Allamakee Comm School District,313,,,134,42.81,2022
97,Woodbury,1975,River Valley Comm School District,316,,,187,59.18,2022
22,Clayton,1989,Edgewood-Colesburg Comm School District,480,,,166,34.58,2022
42,Hardin,2007,Eldora-New Providence Comm School District,496,,,222,44.76,2022
74,Palo Alto,2088,Emmetsburg Comm School District,735,,,298,40.54,2022
48,Iowa,2097,English Valleys Comm School District,412,,,188,45.63,2022
73,Page,2113,Essex Comm School District,196,,,110,56.12,2022
32,Emmet,2124,Estherville Lincoln Central Com Sch Dist,1143,,,600,52.49,2022
83,Shelby,2151,Exira-Elk Horn- Kimballton Comm Sch Dist,371,,,187,50.4,2022
51,Jefferson,2169,Fairfield Comm School District,1456,,,714,49.04,2022
95,Winnebago,2295,Forest City Comm School District,1078,,,425,39.42,2022
94,Webster,2313,Fort Dodge Comm School District,3423,,,2080,60.77,2022
56,Lee,2322,Fort Madison Comm School District,1762,,,963,54.65,2022
36,Fremont,2369,Fremont-Mills Comm School District,418,,,154,36.84,2022
47,Ida,2376,Galva-Holstein Comm School District,457,,,168,36.76,2022
41,Hancock,2403,Garner-Hayfield-Ventura Comm School District,904,,,234,25.88,2022
60,Lyon,2457,George-Little Rock Comm School District,401,,,180,44.89,2022
85,Story,2466,Gilbert Comm School District,1615,,,132,8.17,2022
46,Humboldt,2493,Gilmore City-Bradgate Comm School District,87,,,59,67.82,2022
38,Grundy,2502,Gladbrook-Reinbeck Comm School District,465,,,159,34.19,2022
65,Mills,2511,Glenwood Comm School District,1934,,,731,37.8,2022
14,Carroll,2520,Glidden-Ralston Comm School District,349,,,105,30.09,2022
74,Palo Alto,2556,Graettinger-Terril Comm School District,310,,,176,56.77,2022
1,Adair,2673,Nodaway Valley Comm School District,590,,,274,46.44,2022
86,Tama,2682,GMG Comm School District,451,,,198,43.9,2022
79,Poweshiek,2709,Grinnell-Newburg Comm School District,1458,,,480,32.92,2022
15,Cass,2718,Griswold Comm School District,379,,,143,37.73,2022
38,Grundy,2727,Grundy Center Comm School District,724,,,205,28.31,2022
39,Guthrie,2754,Guthrie Center Comm School District,432,,,137,31.71,2022
22,Clayton,2763,Clayton Ridge Comm School District,1455,,,655,45.02,2022
48,Iowa,2766,H-L-V Comm School District,283,,,86,30.39,2022
36,Fremont,2772,Hamburg Comm School District,155,,,106,68.39,2022
35,Franklin,2781,Hampton-Dumont Comm School District,1240,,,692,55.81,2022
83,Shelby,2826,Harlan Comm School District,1422,,,544,38.26,2022
30,Dickinson,2846,Harris-Lake Park Comm School District,313,,,97,30.99,2022
71,O'Brien,2862,Hartley-Melvin-Sanborn Comm School District,613,,,310,50.57,2022
92,Washington,2977,Highland  Comm School District,515,,,113,21.94,2022
75,Plymouth,2988,Hinton Comm School District,804,,,126,15.67,2022
45,Howard,3029,Howard-Winneshiek Comm School District,984,,,470,47.76,2022
42,Hardin,3033,Hubbard-Radcliffe Comm School District,340,,,142,41.76,2022
7,Black Hawk,3042,Hudson Comm School District,817,,,204,24.97,2022
46,Humboldt,3060,Humboldt Comm School District,1439,,,568,39.47,2022
10,Buchanan,3105,Independence Comm School District,1380,,,488,35.36,2022
91,Warren,3114,Indianola Comm School District,3527,,,1049,29.74,2022
61,Madison,3119,Interstate 35 Comm School District,797,,,191,23.96,2022
52,Johnson,3141,Iowa City Comm School District,14262,,,5797,40.65,2022
42,Hardin,3150,Iowa Falls Comm School District,1162,,,466,40.1,2022
48,Iowa,3154,Iowa Valley Comm School District,490,,,194,39.59,2022
14,Carroll,3168,IKM-Manning Comm School District,655,,,250,38.17,2022
9,Bremer,3186,Janesville Consolidated School District,442,,,92,20.81,2022
37,Greene,3195,Greene County Comm School District,1160,,,559,48.19,2022
10,Buchanan,3204,Jesup Comm School District,958,,,208,21.71,2022
77,Polk,3231,Johnston Comm School District,7215,,,1903,26.38,2022
56,Lee,3312,Keokuk Comm School District,1690,,,1023,60.53,2022
54,Keokuk,3330,Keota Comm School District,293,,,116,39.59,2022
75,Plymouth,3348,Kingsley-Pierson Comm School District,453,,,167,36.87,2022
63,Marion,3375,Knoxville Comm School District,1564,,,769,49.17,2022
95,Winnebago,3420,Lake Mills Comm School District,638,,,206,32.29,2022
27,Decatur,3465,Lamoni Comm School District,342,,,203,59.36,2022
76,Pocahontas,3537,Laurens-Marathon Comm School District,118,,,70,59.32,2022
97,Woodbury,3555,Lawton-Bronson Comm School District,683,,,162,23.72,2022
75,Plymouth,3600,Le Mars Comm School District,2191,,,830,37.88,2022
87,Taylor,3609,Lenox Comm School District,477,,,265,55.56,2022
78,Pottawattamie,3645,Lewis Central Comm School District,2946,,,1106,37.54,2022
16,Cedar,3691,North Cedar Comm School District,586,,,251,42.83,2022
57,Linn,3715,Linn-Mar Comm School District,7402,,,1765,23.84,2022
57,Linn,3744,Lisbon Comm School District,667,,,139,20.84,2022
43,Harrison,3798,Logan-Magnolia Comm School District,671,,,213,31.74,2022
52,Johnson,3816,Lone Tree Comm School District,392,,,108,27.55,2022
58,Louisa,3841,Louisa-Muscatine Comm School District,772,,,291,37.69,2022
55,Kossuth,3897,LuVerne Comm School District,26,,,17,65.38,2022
50,Jasper,3906,Lynnville-Sully Comm School District,520,,,113,21.73,2022
8,Boone,3942,Madrid Comm School District,652,,,181,27.76,2022
65,Mills,3978,East Mills Comm School District,420,,,185,44.05,2022
13,Calhoun,4023,Manson Northwest Webster Comm School District,719,,,204,28.37,2022
67,Monona,4033,Maple Valley-Anthon Oto Comm School District,617,,,319,51.7,2022
49,Jackson,4041,Maquoketa Comm School District,1224,,,661,54,2022
28,Delaware,4043,Maquoketa Valley Comm School District,661,,,189,28.59,2022
18,Cherokee,4068,Marcus-Meriden-Cleghorn Comm School District,363,,,116,31.96,2022
57,Linn,4086,Marion Independent School District,2115,,,804,38.01,2022
64,Marshall,4104,Marshalltown Comm School District,4874,,,3338,68.49,2022
91,Warren,4122,Martensdale-St Marys Comm School District,543,,,110,20.26,2022
17,Cerro Gordo,4131,Mason City Comm School District,3320,,,1853,55.81,2022
84,Sioux,4149,MOC-Floyd Valley Comm School District,1489,,,411,27.6,2022
29,Des Moines,4203,Mediapolis Comm School District,968,,,301,31.1,2022
63,Marion,4212,Melcher-Dallas Comm School District,309,,,102,33.01,2022
53,Jones,4269,Midland Comm School District,485,,,254,52.37,2022
92,Washington,4271,Mid-Prairie Comm School District,1348,,,332,24.63,2022
43,Harrison,4356,Missouri Valley Comm School District,717,,,298,41.56,2022
22,Clayton,4419,MFL MarMac Comm School District,815,,,276,33.87,2022
79,Poweshiek,4437,Montezuma Comm School District,456,,,152,33.33,2022
53,Jones,4446,Monticello Comm School District,974,,,315,32.34,2022
4,Appanoose,4491,Moravia Comm School District,364,,,186,51.1,2022
93,Wayne,4505,Mormon Trail Comm School District,195,,,111,56.92,2022
58,Louisa,4509,Morning Sun Comm School District,108,,,45,41.67,2022
4,Appanoose,4518,Moulton-Udell Comm School District,157,,,89,56.69,2022
80,Ringgold,4527,Mount Ayr Comm School District,587,,,273,46.51,2022
44,Henry,4536,Mount Pleasant Comm School District,1767,,,866,49.01,2022
57,Linn,4554,Mount Vernon Comm School District,1354,,,236,17.43,2022
20,Clarke,4572,Murray Comm School District,271,,,107,39.48,2022
70,Muscatine,4581,Muscatine Comm School District,4331,,,2265,52.3,2022
19,Chickasaw,4599,Nashua-Plainfield Comm School District,541,,,172,31.79,2022
85,Story,4617,Nevada Comm School District,1463,,,493,33.7,2022
11,Buena Vista,4644,Newell-Fonda Comm School District,543,,,246,45.3,2022
19,Chickasaw,4662,New Hampton Comm School District,939,,,306,32.59,2022
44,Henry,4689,New London Comm School District,568,,,235,41.37,2022
50,Jasper,4725,Newton Comm School District,2729,,,1502,55.04,2022
98,Worth,4772,Central Springs Comm School District,740,,,298,40.27,2022
23,Clinton,4773,Northeast Comm School District,823,,,253,30.74,2022
33,Fayette,4774,North Fayette Valley Comm School District,1042,,,424,40.69,2022
62,Mahaska,4776,North Mahaska Comm School District,583,,,186,31.9,2022
57,Linn,4777,North Linn Comm School District,489,,,118,24.13,2022
55,Kossuth,4778,North Kossuth Comm School District,234,,,130,55.56,2022
77,Polk,4779,North Polk Comm School District,2134,,,209,9.79,2022
82,Scott,4784,North Scott Comm School District,3305,,,824,24.93,2022
86,Tama,4785,North Tama County Comm School District,437,,,178,40.73,2022
98,Worth,4788,Northwood-Kensett Comm School District,519,,,194,37.38,2022
91,Warren,4797,Norwalk Comm School District,3426,,,708,20.67,2022
47,Ida,4860,Odebolt Arthur Battle Creek Ida Grove Comm School District,910,,,410,45.05,2022
33,Fayette,4869,Oelwein Comm School District,1238,,,716,57.84,2022
8,Boone,4878,Ogden Comm School District,699,,,176,25.18,2022
30,Dickinson,4890,Okoboji Comm School District,1167,,,454,38.9,2022
53,Jones,4905,Olin Consolidated School District,81,,,43,53.09,2022
1,Adair,4978,Orient-Macksburg Comm School District,133,,,84,63.16,2022
66,Mitchell,4995,Osage Comm School District,927,,,298,32.15,2022
62,Mahaska,5013,Oskaloosa Comm School District,1982,,,926,46.72,2022
90,Wapello,5049,Ottumwa Comm School District,4556,,,2095,45.98,2022
39,Guthrie,5121,Panorama Comm School District,648,,,251,38.73,2022
37,Greene,5139,Paton-Churdan Comm School District,177,,,70,39.55,2022
50,Jasper,5160,PCM Comm School District,1074,,,290,27,2022
51,Jefferson,5163,Pekin Comm School District,602,,,195,32.39,2022
63,Marion,5166,Pella Comm School District,2370,,,425,17.93,2022
25,Dallas,5184,Perry Comm School District,1711,,,1022,59.73,2022
82,Scott,5250,Pleasant Valley Comm School District,5539,,,619,11.18,2022
63,Marion,5256,Pleasantville Comm School District,746,,,258,34.58,2022
76,Pocahontas,5283,Pocahontas Area Comm School District,696,,,403,57.9,2022
3,Allamakee,5310,Postville Comm School District,663,,,489,73.76,2022
94,Webster,5325,Prairie Valley Comm School District,534,,,225,42.13,2022
69,Montgomery,5463,Red Oak Comm School District,970,,,551,56.8,2022
75,Plymouth,5486,Remsen-Union Comm School District,296,,,103,34.8,2022
45,Howard,5508,Riceville Comm School District,374,,,173,46.26,2022
78,Pottawattamie,5510,Riverside Comm School District,641,,,258,40.25,2022
84,Sioux,5607,Rock Valley Comm School District,895,,,405,45.25,2022
85,Story,5643,Roland-Story Comm School District,1069,,,227,21.23,2022
34,Floyd,5697,Rudd-Rockford-Marble Rk Comm School District,382,,,209,54.71,2022
74,Palo Alto,5724,Ruthven-Ayrshire Comm School District,150,,,84,56,2022
66,Mitchell,5751,St Ansgar Comm School District,571,,,143,25.04,2022
77,Polk,5805,Saydel Comm School District,1266,,,741,58.53,2022
81,Sac,5823,Schaller-Crestland Comm School District,308,,,154,50,2022
24,Crawford,5832,Schleswig Comm School District,123,,,54,43.9,2022
97,Woodbury,5877,Sergeant Bluff-Luton Comm School District,1637,,,518,31.64,2022
93,Wayne,5895,Seymour Comm School District,200,,,117,58.5,2022
17,Cerro Gordo,5922,West Fork Comm School District,702,,,285,40.6,2022
71,O'Brien,5949,Sheldon Comm School District,1108,,,478,43.14,2022
73,Page,5976,Shenandoah Comm School District,1010,,,381,37.72,2022
72,Osceola,5994,Sibley-Ocheyedan Comm School District,681,,,344,50.51,2022
36,Fremont,6003,Sidney Comm School District,465,,,231,49.68,2022
54,Keokuk,6012,Sigourney Comm School District,557,,,208,37.34,2022
84,Sioux,6030,Sioux Center Comm School District,1579,,,706,44.71,2022
11,Buena Vista,6035,Sioux Central Comm School District,606,,,189,31.19,2022
97,Woodbury,6039,Sioux City Comm School District,14270,,,9587,67.18,2022
13,Calhoun,6091,South Central Calhoun Comm School District,830,,,396,47.71,2022
52,Johnson,6093,Solon Comm School District,1457,,,112,7.69,2022
91,Warren,6094,Southeast Warren Comm School District,434,,,124,28.57,2022
40,Hamilton,6095,South Hamilton Comm School District,654,,,189,28.9,2022
94,Webster,6096,Southeast Webster Grand Comm School District,498,,,220,44.18,2022
73,Page,6097,South Page Comm School District,108,,,78,72.22,2022
86,Tama,6098,South Tama County,1405,,,862,61.35,2022
71,O'Brien,6099,South O'Brien  Comm School District,518,,,176,33.98,2022
96,Winneshiek,6100,South Winneshiek Comm School District,497,,,151,30.38,2022
77,Polk,6101,Southeast Polk Comm School District,7059,,,2552,36.15,2022
21,Clay,6102,Spencer Comm School District,2163,,,973,44.98,2022
30,Dickinson,6120,Spirit Lake Comm School District,1219,,,320,26.25,2022
57,Linn,6138,Springville Comm School District,409,,,105,25.67,2022
69,Montgomery,6165,Stanton Comm School District,265,,,109,41.13,2022
33,Fayette,6175,Starmont Comm School District,550,,,257,46.73,2022
11,Buena Vista,6219,Storm Lake Comm School District,2693,,,1847,68.59,2022
40,Hamilton,6246,Stratford Comm School District,62,,,32,51.61,2022
39,Guthrie,6264,West Central Valley Comm School District,793,,,340,42.88,2022
9,Bremer,6273,Sumner-Fredericksburg Comm School District,759,,,279,36.76,2022
16,Cedar,6408,Tipton Comm School District,906,,,281,31.02,2022
78,Pottawattamie,6453,Treynor Comm School District,795,,,98,12.33,2022
78,Pottawattamie,6460,Tri-Center Comm School District,682,,,202,29.62,2022
54,Keokuk,6462,Tri-County Comm School District,191,,,83,43.46,2022
9,Bremer,6471,Tripoli Comm School District,348,,,149,42.82,2022
96,Winneshiek,6509,Turkey Valley Comm School District,339,,,133,39.23,2022
63,Marion,6512,Twin Cedars Comm School District,323,,,155,47.99,2022
46,Humboldt,6516,Twin Rivers Comm School District,42,,,20,47.62,2022
78,Pottawattamie,6534,Underwood Comm School District,793,,,124,15.64,2022
7,Black Hawk,6536,Union Comm School District,959,,,272,28.36,2022
8,Boone,6561,United Comm School District,274,,,71,25.91,2022
77,Polk,6579,Urbandale Comm School District,4040,,,1625,40.22,2022
89,Van Buren,6592,Van Buren County Comm School District,807,,,464,57.5,2022
25,Dallas,6615,Van Meter Comm School District,1027,,,69,6.72,2022
69,Montgomery,6651,Villisca Comm School District,260,,,146,56.15,2022
6,Benton,6660,Vinton-Shellsburg Comm School District,1452,,,617,42.49,2022
44,Henry,6700,Waco Comm School District,472,,,221,46.82,2022
81,Sac,6741,East Sac County Comm School District,783,,,330,42.15,2022
58,Louisa,6759,Wapello Comm School District,513,,,187,36.45,2022
9,Bremer,6762,Wapsie Valley Comm School District,662,,,136,20.54,2022
92,Washington,6768,Washington Comm School District,1533,,,785,51.21,2022
7,Black Hawk,6795,Waterloo Comm School District,10052,,,7379,73.41,2022
25,Dallas,6822,Waukee Comm School District,12711,,,2332,18.35,2022
9,Bremer,6840,Waverly-Shell Rock Comm School District,2274,,,525,23.09,2022
93,Wayne,6854,Wayne Comm School District,598,,,313,52.34,2022
40,Hamilton,6867,Webster City Comm School District,1712,,,852,49.77,2022
74,Palo Alto,6921,West Bend-Mallard Comm School District,362,,,173,47.79,2022
16,Cedar,6930,West Branch Comm School District,816,,,205,25.12,2022
29,Des Moines,6937,West Burlington Ind School District,883,,,355,40.2,2022
33,Fayette,6943,West Central Comm School District,288,,,138,47.92,2022
28,Delaware,6950,West Delaware County Comm School District,1293,,,493,38.13,2022
77,Polk,6957,West Des Moines Comm School District,8807,,,3378,38.36,2022
31,Dubuque,6961,Western Dubuque Comm School District,3439,,,872,25.36,2022
43,Harrison,6969,West Harrison Comm School District,293,,,144,49.15,2022
70,Muscatine,6975,West Liberty Comm School District,1214,,,658,54.2,2022
60,Lyon,6983,West Lyon Comm School District,917,,,250,27.26,2022
64,Marshall,6985,West Marshall Comm School District,896,,,272,30.36,2022
67,Monona,6987,West Monona Comm School District,594,,,285,47.98,2022
84,Sioux,6990,West Sioux Comm School District,729,,,411,56.38,2022
97,Woodbury,6992,Westwood Comm School District,588,,,219,37.24,2022
67,Monona,7002,Whiting Comm School District,159,,,77,48.43,2022
48,Iowa,7029,Williamsburg Comm School District,1191,,,306,25.69,2022
70,Muscatine,7038,Wilton Comm School District,915,,,298,32.57,2022
44,Henry,7047,Winfield-Mt Union Comm School District,360,,,170,47.22,2022
61,Madison,7056,Winterset Comm School District,1608,,,548,34.08,2022
43,Harrison,7092,Woodbine Comm School District,461,,,182,39.48,2022
97,Woodbury,7098,Woodbury Central Comm School District,535,,,162,30.28,2022
25,Dallas,7110,Woodward-Granger Comm School District,1127,,,215,19.08,2022
42,Hardin,8100,Choice Charter Schools,86,,,0,0,2022
42,Hardin,9,AGWSR Comm School District,617,,,266,43.11,2021
39,Guthrie,18,Adair-Casey Comm School District,250,,,103,41.2,2021
25,Dallas,27,Adel DeSoto Minburn Comm School District,2108,,,391,18.55,2021
75,Plymouth,63,Akron Westfield Comm School District,584,,,175,29.97,2021
11,Buena Vista,72,Albert City-Truesdale Comm School District,92,,,48,52.17,2021
68,Monroe,81,Albia Comm School District,1096,,,382,34.85,2021
57,Linn,99,Alburnett Comm School District,685,,,135,19.71,2021
42,Hardin,108,Alden Comm School District,143,,,58,40.56,2021
55,Kossuth,126,Algona Comm School District,1408,,,494,35.09,2021
3,Allamakee,135,Allamakee Comm School District,1027,,,431,41.97,2021
12,Butler,153,North Butler Comm School District,539,,,124,23.01,2021
11,Buena Vista,171,Alta-Aurelia Comm School District,772,,,295,38.21,2021
85,Story,225,Ames Comm School District,4496,,,1261,28.05,2021
53,Jones,234,Anamosa Comm School District,1146,,,405,35.34,2021
49,Jackson,243,Andrew Comm School District,131,,,46,35.11,2021
77,Polk,261,Ankeny Comm School District,12263,,,2093,17.07,2021
12,Butler,279,Aplington-Parkersburg Comm School District,805,,,166,20.62,2021
32,Emmet,333,North Union Comm School District,307,,,160,52.12,2021
24,Crawford,355,Ar-We-Va Comm School District,225,,,90,40,2021
15,Cass,387,Atlantic Comm School District,1448,,,795,54.9,2021
5,Audubon,414,Audubon Comm School District,515,,,173,33.59,2021
78,Pottawattamie,441,AHSTW Comm School District,697,,,268,38.45,2021
85,Story,472,Ballard Comm School District,1777,,,249,14.01,2021
50,Jasper,513,Baxter Comm School District,450,,,116,25.78,2021
38,Grundy,540,BCLUW Comm School District,503,,,183,36.38,2021
87,Taylor,549,Bedford Comm School District,475,,,194,40.84,2021
6,Benton,576,Belle Plaine Comm School District,464,,,180,38.79,2021
49,Jackson,585,Bellevue Comm School District,685,,,158,23.07,2021
99,Wright,594,Belmond-Klemme Comm School District,688,,,327,47.53,2021
16,Cedar,603,Bennett Comm School District,66,,,37,56.06,2021
6,Benton,609,Benton Comm School District,1484,,,403,27.16,2021
82,Scott,621,Bettendorf Comm School District,4485,,,1368,30.5,2021
90,Wapello,657,Eddyville-Blakesburg- Fremont CSD,921,,,295,32.03,2021
77,Polk,720,Bondurant-Farrar Comm School District,2497,,,455,18.22,2021
8,Boone,729,Boone Comm School District,1860,,,773,41.56,2021
84,Sioux,747,Boyden-Hull Comm School District,607,,,217,35.75,2021
41,Hancock,819,West Hancock Comm School District,557,,,216,38.78,2021
79,Poweshiek,846,Brooklyn-Guernsey-Malcom Comm School District,556,,,234,42.09,2021
